[
  {
    "name": "Sekoliko",
    "url": "https://github.com/julkwel/sekoliko",
    "description": "Open source school management web application for school and university operations, including fee management, reporting, attendance, and administration workflows.",
    "category": "education",
    "language": "PHP",
    "framework": "Symfony 4",
    "license": "MIT",
    "status": "unknown",
    "maintainer": "julkwel",
    "target_users": [
      "schools",
      "universities",
      "administrators",
      "teachers"
    ],
    "madagascar_relevance": "The project README explicitly describes Sekoliko as a SaaS app for schools and universities in Madagascar, making it directly relevant to local education administration needs.",
    "tags": [
      "madagascar",
      "education",
      "school-management",
      "symfony",
      "php"
    ],
    "notes": "The repository README and GitHub topics indicate a Symfony-based school management platform. Status is marked 'unknown' because current maintenance level was not confidently verified during manual review."
  },
  {
    "name": "Madagascar Map",
    "url": "https://github.com/julkwel/madagascar-map",
    "description": "Open dataset repository listing Malagasy regions, districts, communes, towns, and fokontany, with JSON files intended for reuse in applications and APIs.",
    "category": "datasets",
    "additional_categories": [
      "delivery-addressing",
      "public-services"
    ],
    "language": "JSON",
    "framework": null,
    "license": "MIT",
    "status": "stable",
    "maintainer": "julkwel",
    "target_users": [
      "developers",
      "researchers",
      "NGOs",
      "public institutions"
    ],
    "madagascar_relevance": "The repository provides structured administrative and locality data for Madagascar, including regions, districts, communes, and fokontany, which is directly useful for local mapping, public-service, delivery, and civic applications.",
    "tags": [
      "madagascar",
      "dataset",
      "map",
      "regions",
      "fokontany"
    ],
    "notes": "The repository provides a reusable territorial reference layer for Madagascar. A visible code push on 2024-01-08 supports a 'stable' catalogue status even without signs of heavy ongoing feature work."
  },
  {
    "name": "PCG 2005",
    "url": "https://github.com/mamyraoby/pcg-2005",
    "description": "Structured data repository for the PCG 2005 chart of accounts used in Malagasy accounting.",
    "category": "datasets",
    "language": "JSON",
    "framework": null,
    "license": "unknown",
    "status": "unknown",
    "maintainer": "mamyraoby",
    "target_users": [
      "developers",
      "accountants",
      "SMEs",
      "finance software builders"
    ],
    "madagascar_relevance": "The repository contains structured data for the Madagascar PCG 2005 accounting framework, which is directly relevant for local accounting, bookkeeping, ERP, and financial software.",
    "tags": [
      "madagascar",
      "dataset",
      "accounting",
      "pcg-2005",
      "finance"
    ],
    "notes": "The repository README describes the project as structured PCG 2005 data for Madagascar. License is marked 'unknown' because a reusable license could not be confidently verified from the repository page reviewed. Status is marked 'unknown' because current maintenance level was not confidently verified during manual review."
  },
  {
    "name": "Gasy Corpus Crawler",
    "url": "https://github.com/SetraC4Ci/Gasy-Corpus-Crawler",
    "description": "Python crawler toolkit for scraping Malagasy-language websites and building text corpora for dataset creation.",
    "category": "language-ai",
    "language": "Python",
    "framework": "BeautifulSoup and Selenium",
    "license": "MIT",
    "status": "experimental",
    "maintainer": "SetraC4Ci",
    "target_users": [
      "researchers",
      "NLP builders",
      "dataset curators",
      "developers"
    ],
    "madagascar_relevance": "The repository is specifically designed to scrape Malagasy-language websites and build Malagasy text corpora, making it directly useful for local NLP, language modeling, and corpus creation work.",
    "tags": [
      "madagascar",
      "malagasy",
      "nlp",
      "corpus",
      "crawler"
    ],
    "notes": "The README presents the project as a set of scripts for corpus scraping with both BeautifulSoup and Selenium variants. The small commit history and script-oriented design suggest an experimental maturity level."
  },
  {
    "name": "MMCLI",
    "url": "https://github.com/HarimbolaSantatra/mm-cli",
    "description": "Command-line Malagasy encyclopedia and dictionary client that queries Malagasyword.org and returns searchable word data.",
    "category": "language-ai",
    "language": "Go",
    "framework": "Beautiful Soup parsing helper",
    "license": "GPL-3.0",
    "status": "experimental",
    "maintainer": "HarimbolaSantatra",
    "target_users": [
      "developers",
      "students",
      "language learners",
      "CLI users"
    ],
    "madagascar_relevance": "The tool is built specifically around Malagasy dictionary and encyclopedia lookup, which makes it directly relevant to Malagasy language access and language-tooling workflows.",
    "tags": [
      "madagascar",
      "malagasy",
      "dictionary",
      "cli",
      "language"
    ],
    "notes": "The README states that the latest release is the only stable version and that the rest remains a work in progress with unresolved issues, so 'experimental' is the safest catalogue status."
  },
  {
    "name": "Mada CLI",
    "url": "https://github.com/tsirysndr/mada",
    "description": "CLI and companion web tooling for searching Malagasy regions, districts, communes, and fokontany.",
    "category": "delivery-addressing",
    "additional_categories": [
      "developer-tools"
    ],
    "language": "Go and TypeScript",
    "framework": "CLI and web tooling",
    "license": "BSD-3-Clause",
    "status": "active",
    "maintainer": "tsirysndr",
    "target_users": [
      "developers",
      "delivery services",
      "mapping builders",
      "public-service tool builders"
    ],
    "madagascar_relevance": "The project is built around Madagascar's administrative and locality structure, including regions, districts, communes, and fokontany, which is directly useful for local search, address handling, and territorial data workflows.",
    "tags": [
      "madagascar",
      "fokontany",
      "addressing",
      "map",
      "cli"
    ],
    "notes": "The repository shows visible maintenance through 2026 and combines reusable territorial lookup with a developer-friendly CLI, making it a strong early catalogue entry."
  },
  {
    "name": "Rakibolana Malagasy",
    "url": "https://github.com/Rohan29-AN/rakibolana_malagasy",
    "description": "Dataset repository containing Malagasy words and their meanings in CSV, JSON, and SQLite formats.",
    "category": "language-ai",
    "language": "JSON",
    "framework": null,
    "license": "unknown",
    "status": "unknown",
    "maintainer": "Rohan29-AN",
    "target_users": [
      "developers",
      "students",
      "researchers",
      "language learners"
    ],
    "madagascar_relevance": "The repository contains Malagasy lexical data and definitions, which is directly useful for dictionary tooling, search, NLP resources, and broader Malagasy language preservation work.",
    "tags": [
      "madagascar",
      "malagasy",
      "dictionary",
      "dataset",
      "language"
    ],
    "notes": "The repository README says the data is free to use and provides CSV, JSON, and SQLite exports, but a formal open source license could not be confidently verified from the repository page reviewed. Status is marked 'unknown' because current maintenance level was not confidently verified during manual review."
  },
  {
    "name": "Pocketenv",
    "url": "https://github.com/pocketenv-io/pocketenv",
    "description": "Open sandbox runtime for agents and humans that provides portable development environments across multiple backend providers.",
    "category": "developer-tools",
    "language": "TypeScript",
    "framework": "Multi-backend sandbox CLI and SDK platform",
    "license": "MPL-2.0",
    "status": "experimental",
    "maintainer": "pocketenv-io",
    "target_users": [
      "developers",
      "AI builders",
      "platform engineers",
      "teams sharing development environments"
    ],
    "madagascar_relevance": "The repository was identified as being built by Malagasy developers, which makes it a relevant developer tool contribution from the local ecosystem and a reusable building block for Madagascar-based software teams.",
    "tags": [
      "madagascar",
      "developer-tools",
      "sandbox",
      "agents",
      "typescript"
    ],
    "notes": "The README describes Pocketenv as a universal sandbox runtime for agents and humans and explicitly warns that it is still in early development, so 'experimental' is the safest catalogue status."
  },
  {
    "name": "Awesome Madagascar",
    "url": "https://github.com/luckasRanarison/awesome-madagascar",
    "description": "Curated Markdown list of projects, tools, websites, and resources related to Madagascar.",
    "category": "meta-catalogue",
    "additional_categories": [
      "developer-tools"
    ],
    "language": "Markdown",
    "framework": "Markdown awesome list",
    "license": "CC0-1.0",
    "status": "active",
    "maintainer": "luckasRanarison",
    "target_users": [
      "developers",
      "students",
      "researchers",
      "ecosystem mappers"
    ],
    "madagascar_relevance": "The repository serves as a discovery layer for Madagascar-related projects and helps maintain ongoing ecosystem visibility across multiple technical domains.",
    "tags": [
      "madagascar",
      "awesome-list",
      "curation",
      "discovery",
      "catalogue"
    ],